[{"access_observed":"not_tested","competition":"SA","coverage":"not_verified","football_data_prior_declared_free":true,"label":"Serie A","real_web_claims_verified":0,"source_id":"serie-a"},{"access_observed":"not_tested","competition":"SB","coverage":"not_verified","football_data_prior_declared_free":false,"label":"Serie B","real_web_claims_verified":0,"source_id":"serie-b"},{"access_observed":"source_blocked","competition":"PL","coverage":"not_verified","football_data_prior_declared_free":true,"label":"Premier League","real_web_claims_verified":0,"source_id":"premierleague"},{"access_observed":"source_blocked","competition":"PD","coverage":"not_verified","football_data_prior_declared_free":true,"label":"LaLiga","real_web_claims_verified":0,"source_id":"laliga"},{"access_observed":"not_tested","competition":"BL1","coverage":"not_verified","football_data_prior_declared_free":true,"label":"Bundesliga","real_web_claims_verified":0,"source_id":"bundesliga"},{"access_observed":"not_tested","competition":"FL1","coverage":"not_verified","football_data_prior_declared_free":true,"label":"Ligue 1","real_web_claims_verified":0,"source_id":"ligue1"},{"access_observed":"not_tested","competition":"DED","coverage":"not_verified","football_data_prior_declared_free":true,"label":"Eredivisie","real_web_claims_verified":0,"source_id":"eredivisie"},{"access_observed":"not_tested","competition":"PPL","coverage":"not_verified","football_data_prior_declared_free":true,"label":"Primeira Liga","real_web_claims_verified":0,"source_id":"primeira"},{"access_observed":"not_tested","competition":"ELC","coverage":"not_verified","football_data_prior_declared_free":true,"label":"EFL Championship","real_web_claims_verified":0,"source_id":"efl"},{"access_observed":"not_tested","competition":"BPL","coverage":"not_verified","football_data_prior_declared_free":false,"label":"Belgian Pro League","real_web_claims_verified":0,"source_id":"belgium"},{"access_observed":"source_blocked","competition":"CL","coverage":"not_verified","football_data_prior_declared_free":true,"label":"UEFA Champions League","real_web_claims_verified":0,"source_id":"uefa"},{"access_observed":"source_blocked","competition":"EL","coverage":"not_verified","football_data_prior_declared_free":false,"label":"UEFA Europa League","real_web_claims_verified":0,"source_id":"uefa"},{"access_observed":"source_blocked","competition":"ECL","coverage":"not_verified","football_data_prior_declared_free":false,"label":"UEFA Conference League","real_web_claims_verified":0,"source_id":"uefa"}]
